{
  "schema_version": "domain_knob_evaluation_contract_v1",
  "contract_version": "domain_knob_evaluation_contract_v1",
  "catalog_version": "domain_knob_catalog_v1",
  "catalog_hash": "sha256:886f82a5c5d7e2e2ff13c8b87f974480684af17692ae994dc5c9086476b1dbfe",
  "metric_registry_hash": "sha256:aafb67d08764b43316c4732500d7e9d9eca481f53741591cd720a1ae01c1194a",
  "calculator_registry_hash": "sha256:f76785cc56ed7361bf9bf0f2e29ccd6d06bc19163f63917bbdb05e6c46406cc4",
  "evaluation_metrics": {
    "alpha_discovery_quality_20d": {
      "id": "alpha_discovery_quality_20d",
      "unit": "ratio",
      "value_convention": "signed_return",
      "direction": "higher_is_better",
      "aggregation": "mean",
      "window": "20d",
      "baseline": "previous_knob_snapshot",
      "calculator_id": "pit.signed_return",
      "calculator_version": "1",
      "valid_range": {
        "minimum": -1,
        "maximum": null
      },
      "null_policy": "exclude_sample",
      "non_finite_policy": "reject_evaluation",
      "normalization_version": "1",
      "uncertainty_method": "paired_block_bootstrap",
      "overlapping_sample_policy": "inverse_overlap_weight",
      "min_sample_size": 30,
      "pit_required": true,
      "exclusion_rules": [
        "missing_required_runtime_source",
        "stale_required_runtime_source",
        "runtime_source_error",
        "lookahead_risk",
        "incomplete_fill",
        "missing_required_evidence_dependency",
        "fallback_dependency_without_policy_allowance"
      ]
    },
    "churn_adjusted_slippage": {
      "id": "churn_adjusted_slippage",
      "unit": "ratio",
      "value_convention": "nonnegative_loss_magnitude",
      "direction": "lower_is_better",
      "aggregation": "mean",
      "window": "5d",
      "baseline": "previous_knob_snapshot",
      "calculator_id": "pit.nonnegative_loss",
      "calculator_version": "1",
      "valid_range": {
        "minimum": 0,
        "maximum": null
      },
      "null_policy": "exclude_sample",
      "non_finite_policy": "reject_evaluation",
      "normalization_version": "1",
      "uncertainty_method": "paired_block_bootstrap",
      "overlapping_sample_policy": "inverse_overlap_weight",
      "min_sample_size": 30,
      "pit_required": true,
      "exclusion_rules": [
        "missing_required_runtime_source",
        "stale_required_runtime_source",
        "runtime_source_error",
        "lookahead_risk",
        "incomplete_fill",
        "missing_required_evidence_dependency",
        "fallback_dependency_without_policy_allowance"
      ]
    },
    "concentration_breach_rate": {
      "id": "concentration_breach_rate",
      "unit": "ratio",
      "value_convention": "rate_0_1",
      "direction": "lower_is_better",
      "aggregation": "hit_rate",
      "window": "20d",
      "baseline": "previous_knob_snapshot",
      "calculator_id": "pit.rate",
      "calculator_version": "1",
      "valid_range": {
        "minimum": 0,
        "maximum": 1
      },
      "null_policy": "exclude_sample",
      "non_finite_policy": "reject_evaluation",
      "normalization_version": "1",
      "uncertainty_method": "wilson_interval",
      "overlapping_sample_policy": "inverse_overlap_weight",
      "min_sample_size": 30,
      "pit_required": true,
      "exclusion_rules": [
        "missing_required_runtime_source",
        "stale_required_runtime_source",
        "runtime_source_error",
        "lookahead_risk",
        "incomplete_fill",
        "missing_required_evidence_dependency",
        "fallback_dependency_without_policy_allowance"
      ]
    },
    "confidence_calibration_error": {
      "id": "confidence_calibration_error",
      "unit": "ratio",
      "value_convention": "rate_0_1",
      "direction": "lower_is_better",
      "aggregation": "calibration_error",
      "window": "5d",
      "baseline": "previous_knob_snapshot",
      "calculator_id": "pit.calibration_error",
      "calculator_version": "1",
      "valid_range": {
        "minimum": 0,
        "maximum": 1
      },
      "null_policy": "exclude_sample",
      "non_finite_policy": "reject_evaluation",
      "normalization_version": "1",
      "uncertainty_method": "block_bootstrap",
      "overlapping_sample_policy": "inverse_overlap_weight",
      "min_sample_size": 30,
      "pit_required": true,
      "exclusion_rules": [
        "missing_required_runtime_source",
        "stale_required_runtime_source",
        "runtime_source_error",
        "lookahead_risk",
        "incomplete_fill",
        "missing_required_evidence_dependency",
        "fallback_dependency_without_policy_allowance"
      ]
    },
    "drawdown_avoidance_after_tail_veto": {
      "id": "drawdown_avoidance_after_tail_veto",
      "unit": "ratio",
      "value_convention": "signed_return",
      "direction": "higher_is_better",
      "aggregation": "mean",
      "window": "20d",
      "baseline": "previous_knob_snapshot",
      "calculator_id": "pit.signed_return",
      "calculator_version": "1",
      "valid_range": {
        "minimum": -1,
        "maximum": null
      },
      "null_policy": "exclude_sample",
      "non_finite_policy": "reject_evaluation",
      "normalization_version": "1",
      "uncertainty_method": "paired_block_bootstrap",
      "overlapping_sample_policy": "inverse_overlap_weight",
      "min_sample_size": 30,
      "pit_required": true,
      "exclusion_rules": [
        "missing_required_runtime_source",
        "stale_required_runtime_source",
        "runtime_source_error",
        "lookahead_risk",
        "incomplete_fill",
        "missing_required_evidence_dependency",
        "fallback_dependency_without_policy_allowance"
      ]
    },
    "execution_quality_5d": {
      "id": "execution_quality_5d",
      "unit": "bps",
      "value_convention": "bps_cost",
      "direction": "lower_is_better",
      "aggregation": "mean",
      "window": "5d",
      "baseline": "previous_knob_snapshot",
      "calculator_id": "pit.bps_cost",
      "calculator_version": "1",
      "valid_range": {
        "minimum": 0,
        "maximum": null
      },
      "null_policy": "exclude_sample",
      "non_finite_policy": "reject_evaluation",
      "normalization_version": "1",
      "uncertainty_method": "paired_block_bootstrap",
      "overlapping_sample_policy": "inverse_overlap_weight",
      "min_sample_size": 30,
      "pit_required": true,
      "exclusion_rules": [
        "missing_required_runtime_source",
        "stale_required_runtime_source",
        "runtime_source_error",
        "lookahead_risk",
        "incomplete_fill",
        "missing_required_evidence_dependency",
        "fallback_dependency_without_policy_allowance"
      ]
    },
    "failed_or_partial_fill_rate": {
      "id": "failed_or_partial_fill_rate",
      "unit": "ratio",
      "value_convention": "rate_0_1",
      "direction": "lower_is_better",
      "aggregation": "hit_rate",
      "window": "5d",
      "baseline": "previous_knob_snapshot",
      "calculator_id": "pit.rate",
      "calculator_version": "1",
      "valid_range": {
        "minimum": 0,
        "maximum": 1
      },
      "null_policy": "exclude_sample",
      "non_finite_policy": "reject_evaluation",
      "normalization_version": "1",
      "uncertainty_method": "wilson_interval",
      "overlapping_sample_policy": "inverse_overlap_weight",
      "min_sample_size": 30,
      "pit_required": true,
      "exclusion_rules": [
        "missing_required_runtime_source",
        "stale_required_runtime_source",
        "runtime_source_error",
        "lookahead_risk",
        "incomplete_fill",
        "missing_required_evidence_dependency",
        "fallback_dependency_without_policy_allowance"
      ]
    },
    "fallback_rate": {
      "id": "fallback_rate",
      "unit": "ratio",
      "value_convention": "rate_0_1",
      "direction": "lower_is_better",
      "aggregation": "hit_rate",
      "window": "5d",
      "baseline": "previous_knob_snapshot",
      "calculator_id": "pit.rate",
      "calculator_version": "1",
      "valid_range": {
        "minimum": 0,
        "maximum": 1
      },
      "null_policy": "exclude_sample",
      "non_finite_policy": "reject_evaluation",
      "normalization_version": "1",
      "uncertainty_method": "wilson_interval",
      "overlapping_sample_policy": "inverse_overlap_weight",
      "min_sample_size": 30,
      "pit_required": true,
      "exclusion_rules": [
        "missing_required_runtime_source",
        "stale_required_runtime_source",
        "runtime_source_error",
        "lookahead_risk",
        "incomplete_fill",
        "missing_required_evidence_dependency",
        "fallback_dependency_without_policy_allowance"
      ]
    },
    "false_veto_adjusted_drawdown_avoidance": {
      "id": "false_veto_adjusted_drawdown_avoidance",
      "unit": "ratio",
      "value_convention": "signed_return",
      "direction": "higher_is_better",
      "aggregation": "mean",
      "window": "20d",
      "baseline": "previous_knob_snapshot",
      "calculator_id": "pit.signed_return",
      "calculator_version": "1",
      "valid_range": {
        "minimum": -1,
        "maximum": null
      },
      "null_policy": "exclude_sample",
      "non_finite_policy": "reject_evaluation",
      "normalization_version": "1",
      "uncertainty_method": "paired_block_bootstrap",
      "overlapping_sample_policy": "inverse_overlap_weight",
      "min_sample_size": 30,
      "pit_required": true,
      "exclusion_rules": [
        "missing_required_runtime_source",
        "stale_required_runtime_source",
        "runtime_source_error",
        "lookahead_risk",
        "incomplete_fill",
        "missing_required_evidence_dependency",
        "fallback_dependency_without_policy_allowance"
      ]
    },
    "hit_rate_5d": {
      "id": "hit_rate_5d",
      "unit": "ratio",
      "value_convention": "rate_0_1",
      "direction": "higher_is_better",
      "aggregation": "hit_rate",